{
  "schemaVersion": 1,
  "bookId": "manual:fixture",
  "title": "手动导入 fixture",
  "source": "manual",
  "generatedAt": "2026-07-10T00:00:00.000Z",
  "updatedAt": "2026-07-10T00:00:00.000Z",
  "chapters": [
    {
      "id": "manual:fixture-1",
      "path": "part/001.md",
      "title": "第一篇",
      "voteCount": 0,
      "wordCount": 10
    }
  ]
}
